{
  "$schema": "https://putnami.dev/schemas/putnami-project.json",
  "name": "go.putnami.dev/protocol/ci",
  "visibility": "public",
  "tags": ["go", "protocol"],
  "extensions": ["/go/extension", "/tooling/sdd-extension"],
  "publish": ["go"],
  "disable": {
    "jobs": ["serve"]
  },
  "options": {
    "test": {
      "filePatterns": ["fixtures/**", "schemas/**"]
    },
    "publish": {
      "archives": false
    },
    "sdd": {
      "verification": {
        "specs": "enforce"
      }
    }
  }
}
