{
  "$schema": "https://putnami.dev/schemas/putnami-project.json",
  "name": "@example/08-real-time",
  "tags": ["e2e", "ts"],
  "extensions": ["/typescript/extension"],
  "featureAuthority": {"owner": "typescript/api-contracts"},
  "options": {
    "test": {
      "coverage": false,
      "coverage-threshold": 0
    },
    "serve": {
      "port": 3908
    }
  }
}
