{
  "$schema": "https://putnami.dev/schemas/putnami-project.json",
  "name": "go.putnami.dev/logger",
  "visibility": "public",
  "tags": [
    "go"
  ],
  "extensions": [
    "/go/extension",
    "/tooling/sdd-extension"
  ],
  "publish": [
    "go"
  ],
  "disable": {
    "jobs": [
      "serve"
    ]
  },
  "options": {
    "publish": {
      "archives": false
    },
    "sdd": {
      "verification": {
        "specs": "enforce"
      }
    }
  }
}
