{
  "$schema": "https://putnami.dev/schemas/putnami-project.json",
  "name": "@putnami/cli-model",
  "tags": [
    "go"
  ],
  "extensions": [
    "/go/extension",
    "/tooling/sdd-extension"
  ],
  "disable": {
    "jobs": [
      "serve"
    ]
  },
  "options": {
    "test": {
      "coverage-threshold": 80
    },
    "sdd": {
      "verification": {
        "specs": "enforce"
      }
    }
  }
}
