{
  "$schema": "https://putnami.dev/schemas/putnami-project.json",
  "name": "typescript-server",
  "type": "template",
  "extensions": [
    "@putnami/scaffold",
    "/tooling/sdd-extension"
  ],
  "publish": [
    "template-archives"
  ],
  "options": {
    "publish": {
      "archives": true
    },
    "sdd": {
      "verification": {
        "specs": "enforce"
      }
    }
  }
}
