{
  "$schema": "https://putnami.dev/schemas/putnami-project.json",
  "name": "go.putnami.dev/protocol/oci",
  "visibility": "public",
  "tags": ["go", "protocol"],
  "extensions": ["/go/extension"],
  "publish": ["go"],
  "disable": {
    "jobs": ["serve"]
  },
  "options": {
    "test": {
      "filePatterns": ["fixtures/**"]
    },
    "publish": {
      "archives": false
    }
  },
  "featureAuthority": {
    "none": "Registry fast paths are transport details behind publish and deploy, not a feature a user enables."
  }
}
